{
  "$schema": "https://json-schema.org/draft/2020-12/schema",
  "$defs": {
    "Attachment": {
      "additionalProperties": false,
      "description": "A file that belongs to a message: name, size in bytes and SHA-256 (hexadecimal).",
      "properties": {
        "name": {
          "pattern": "^[A-Za-z0-9_#+-][A-Za-z0-9._#+-]{0,127}$",
          "title": "Name",
          "type": "string"
        },
        "size": {
          "minimum": 0,
          "title": "Size",
          "type": "integer"
        },
        "sha256": {
          "pattern": "^[0-9a-f]{64}$",
          "title": "Sha256",
          "type": "string"
        }
      },
      "required": [
        "name",
        "size",
        "sha256"
      ],
      "title": "Attachment",
      "type": "object"
    },
    "JsonValue": {}
  },
  "additionalProperties": false,
  "description": "A message with the fields of req-grund-004.",
  "properties": {
    "id": {
      "format": "uuid",
      "title": "Id",
      "type": "string"
    },
    "sender": {
      "pattern": "^[A-Za-z0-9][A-Za-z0-9_-]{0,62}\\.[A-Za-z0-9][A-Za-z0-9_-]{0,62}\\.[A-Za-z0-9][A-Za-z0-9_-]{0,62}$",
      "title": "Sender",
      "type": "string"
    },
    "recipient": {
      "pattern": "^[A-Za-z0-9][A-Za-z0-9_-]{0,62}\\.[A-Za-z0-9][A-Za-z0-9_-]{0,62}\\.[A-Za-z0-9][A-Za-z0-9_-]{0,62}$",
      "title": "Recipient",
      "type": "string"
    },
    "priority": {
      "pattern": "^[a-z0-9_-]{1,32}$",
      "title": "Priority",
      "type": "string"
    },
    "kind": {
      "maxLength": 64,
      "pattern": "^[a-z][a-z0-9_]*(\\.[a-z][a-z0-9_]*)*$",
      "title": "Kind",
      "type": "string"
    },
    "content": {
      "additionalProperties": {
        "$ref": "#/$defs/JsonValue"
      },
      "title": "Content",
      "type": "object"
    },
    "reference_id": {
      "anyOf": [
        {
          "format": "uuid",
          "type": "string"
        },
        {
          "type": "null"
        }
      ],
      "default": null,
      "title": "Reference Id"
    },
    "created_at": {
      "format": "date-time",
      "title": "Created At",
      "type": "string"
    },
    "attachments": {
      "default": [],
      "items": {
        "$ref": "#/$defs/Attachment"
      },
      "maxItems": 256,
      "title": "Attachments",
      "type": "array"
    },
    "receipt": {
      "default": false,
      "title": "Receipt",
      "type": "boolean"
    }
  },
  "required": [
    "id",
    "sender",
    "recipient",
    "priority",
    "kind",
    "content",
    "created_at"
  ],
  "title": "Message",
  "type": "object"
}
