{
  "id": "0b0a6f3e-2f1d-4a58-9a52-6a6a1f1c2d11",
  "sender": "app-a.net1.relay1",
  "recipient": "app-b.net1.relay2",
  "priority": "normal",
  "kind": "example.request",
  "content": {
    "text": "hello"
  },
  "reference_id": null,
  "created_at": "2026-10-24T12:00:00Z",
  "attachments": [],
  "receipt": false
}
